|user|item|rating|review
1715|leonardlloyd.solon|xiaomi redmi note 9s|8.9|a massive specs in one device amazing 
1716|randyasyraaf57|xiaomi redmi note 9s|8.7|it is very capable phone
1717|nelushgayashan|xiaomi redmi note 9s|10.0|great budget phone with powerful processor
1718|AraFatJr|xiaomi redmi note 9s|7.4|good
1719|ismailbrairi|xiaomi redmi note 9s|9.6|excellent
1720|omid80omidian|xiaomi redmi note 9s|9.9|every thing was perfect
1721|faizkasyfi.fk|xiaomi redmi note 9s|10.0|good value for midrange phone
1722|davi.m.74|xiaomi redmi note 9s|10.0|my verdict is a very good device for the price it costs
1723|tofei|xiaomi redmi note 9s|7.7|good midrange phone for 2020
1724|arash.rezaee.c|xiaomi redmi note 9s|8.7|good for gaming
1725|sonicthebest1|xiaomi redmi note 9s|9.9|great
1726|scootylisa98|xiaomi redmi note 9s|10.0|for the price the phone truly delivers and a great all rounder
1727|johnmorriss12987|xiaomi redmi note 9s|10.0|fantastic phone yet again
1728|mrmickholly08|xiaomi redmi note 9s|10.0|super phone
1729|grarunkumar1994|xiaomi redmi note 9s|8.2|good phone for everyday use
1730|mobilelegends131195|xiaomi redmi note 9s|8.0|all so good
1731|soma.nemeskeri|xiaomi redmi note 9s|10.0|probably the best phone for everyday usage
1732|kospap2002|xiaomi redmi note 9s|9.7|a fantastic phone for the money i gave to buy it i highly recommend it
1733|stoneridgesocial|xiaomi redmi note 9s|8.1|no internet on t mobile missing band 12 usa dallas tx
1734|sars.0123|xiaomi redmi note 9s|10.0|best phone for the price
1735|sole29157|xiaomi redmi note 9s|9.2|a good phone for demanding applications
1736|miguetrigue2|xiaomi redmi note 9s|10.0|excellent performance mobile excellent aesthetics and construction
1737|unaifercol|xiaomi redmi note 9s|7.9|a device with a bittersweet flavor  i keep the previous version
1738|martymcfly1890|xiaomi redmi note 9s|9.3|it is a good terminal but it does not evolve as much with respect to its predecessor
1739|elcirca|xiaomi redmi note 9s|9.4|excellent team
1740|franjefersp|xiaomi redmi note 9s|9.4|the second best in quality price after poco x3
1741|albertocides|xiaomi redmi note 9s|9.1|good low priced mobile with huge battery but without nfc
1742|yvel|xiaomi redmi note 9s|9.8|good pretty and cheap
1743|kirill.alasheev|xiaomi redmi note 9s|10.0|good
1744|felipeevangelistadacunha|xiaomi redmi note 9s|9.0|good smartphone
1745|Sbeven|xiaomi redmi note 9s|9.5|very good terminal quality price
1746|petallende13|xiaomi redmi note 9s|9.5|the device is very round and comfortable if you are thinking of buying it i recommend it
1747|jhojanduque4|xiaomi redmi note 9s|10.0|i had a huawei p20 lite and it was a big change in terms of battery fluidity and warm up i like it i recommend it in this 2021
1748|ALCATRAZ|xiaomi redmi note 9s|8.8|good
1749|jp101466|xiaomi redmi note 9s|9.7|good mobile for a good price
1750|leonespartano006|xiaomi redmi note 9s|10.0|the best phone price quality
1751|l.gasselin29|xiaomi redmi note 9s|10.0|one of the best
1752|manolopascheco|xiaomi redmi note 9s|10.0|it is a very good team
1753|wrucebilis|xiaomi redmi note 9s|10.0|quality excellent price as always
1754|Wellington|xiaomi redmi note 9s|9.8|extremely fluid in daily use it corresponded to high performance expectations
1755|lyncus234|xiaomi redmi note 9s|9.2|a phone that every problem you have can be solved
1756|moizes|xiaomi redmi note 9s|7.0|it is great value for money
1757|rufobeccar|xiaomi redmi note 9s|7.5|it is a good phone but for 2022 there are better options
1758|chevroletmustangferrari|xiaomi redmi note 9s|8.5|excellent for day to day
1759|gabrieljaime.titin|xiaomi redmi note 9s|9.2|the best you can buy in the range 200 260 right now
1760|RedmiBigLove|xiaomi redmi note 9s|10.0|great phone in terms of value for money nothing to complain about
1761|RolandoSilva|xiaomi redmi note 9s|10.0|the best experience to have such a low price
1762|patinojuanpablo85|xiaomi redmi note 9s|7.9|a very good phone
1763|diegoreyesmarin|xiaomi redmi note 9s|10.0|good equipment at an affordable price
1764|snapshot1286|xiaomi redmi note 9s|10.0|excellent balanced smartphone
1765|majinvegeta78|xiaomi redmi note 9s|9.4|very good phone behaves well in demanding games good battery
1766|ricardotepole30|xiaomi redmi note 9s|9.9|very good price quality device
1767|anthonypro2222|xiaomi redmi note 9s|8.5|good mobile
1768|dividebypie201|xiaomi redmi note 9s|4.5|it came very soon against the redmi note 8
1769|matiasguma9|xiaomi redmi note 9s|10.0|excellent price quality
1770|luisfer225|xiaomi redmi note 9s|10.0|excellent
1771|Gtabimael|xiaomi redmi note 9s|5.1|regularly good
1772|JoseReyes|xiaomi redmi note 9s|8.0|cheap mobile with good features
1773|cristianjrc519|xiaomi redmi note 9s|10.0|basically it is the best cell phone you can buy for the price it has but you may find a disagreement
1774|javigmiono|xiaomi redmi note 9s|10.0|excellent
1775|babvel1|xiaomi redmi note 9s|9.4|it is a good mobile
1776|arjona4323|xiaomi redmi note 9s|10.0|good for the price
1777|bryan99juvera|xiaomi redmi note 9s|9.4|very good buy 
1778|ikeper24|xiaomi redmi note 9s|8.7|good for little money
1779|tomasabp1996|xiaomi redmi note 9s|8.5|it is a good device for its price worth
1780|manuelmaciel|xiaomi redmi note 9s|9.3|meet spectavivas for its low price
1781|darkilo_91|xiaomi redmi note 9s|9.6|a mid range with premium mid range power
1782|wesleygamers22|xiaomi redmi note 9s|9.6|for the cost benefit i have a premium intermediate in hands 
1783|fjavips|xiaomi redmi note 9s|9.0|good phone especially for games
1784|cristian-novoa-5edaac66b575f|xiaomi redmi note 9s|10.0|very pretty
1785|infopanguel|xiaomi redmi note 9s|10.0|for the price it has you are amazed at the great quality it has and fluidity on a daily basis highly recommended do not envy a top
1786|rueda.castillo|xiaomi redmi note 9s|8.9|taking the price as a reference is probably the smart purchase
1787|rcd377|xiaomi redmi note 9s|7.8|a good buy
1788|aldorivera203|xiaomi redmi note 9s|8.3|the best that can be found for this price range
1789|charlyccs95|xiaomi redmi note 9s|10.0|good cell phone meets my expectations
1790|garrapata01|xiaomi redmi note 9s|9.5|the best mobile of 2020
1791|kike7890.cruz|xiaomi redmi note 9s|7.9|good mid range
1792|lopez_r.carlos|xiaomi redmi note 9s|9.5|everything you are looking for in a cel well balanced in every way
1793|plazita44|xiaomi redmi note 9s|9.1|great phone value for money
1794|fhasenov0|xiaomi redmi note 9s|8.0|inexpensive smartphone
1795|niksioidualisia|xiaomi redmi note 9s|10.0|i switched to it from samsung galaxy j3 2016  everything is great
1796|mundooculto99|xiaomi redmi note 9s|10.0|excellent quality price terminal
1797|rodrif19|xiaomi redmi note 9s|10.0|mobil fairly good quality / price lack of optimization
1798|josenic210|xiaomi redmi note 9s|10.0|i always wanted to have this cell phone and now that i have it it is wonderful 10/10
1799|Wally|xiaomi redmi note 9s|4.7|good team if you are just looking to play otherwise it is decent very bad screen
1800|nathan-valdez-6181ea74083ad|xiaomi redmi note 9s|5.9|the phone is nice fast effective and comfortable the only problem i found was in its update system
1801|spmadureira|xiaomi redmi note 9s|10.0|very very good quality price 
1802|andrea.massa74|xiaomi redmi note 9s|5.3|good but can be improved
1803|alihwerty55|xiaomi redmi note 9s|7.9|i use the phone for 3 weeks for games suitable top for my money
1804|belyyy97|xiaomi redmi note 9s|9.2|not bad
1805|josper456|xiaomi redmi note 9s|10.0|for now it is amazing i honestly say it
1806|junior.morais.hexa|xiaomi redmi note 9s|9.0|nice
1807|frnanciscocolon123|xiaomi redmi note 9s|9.0|it is a very good phone powerful for gaming it is quite fluid
1808|Anedi18|xiaomi redmi note 9s|9.4|considering the price great
1809|rsilva6420|xiaomi redmi note 9s|7.1|entry phone with good cost/benefit ratio
1810|ghgustavo457|xiaomi redmi note 9s|9.1|incredible cell phone
1811|Therose|xiaomi redmi note 9s|6.6|it is a good phone but miui ruins it
1812|gs75352|xiaomi redmi note 9s|10.0|great cost benefit
1813|fernando.cabral90|xiaomi redmi note 9s|8.8|very good quality / price
1814|ibrad3419|xiaomi redmi note 9s|9.8|good
1815|DavidChac|xiaomi redmi note 9s|8.0|very good
1816|andre.seq|xiaomi redmi note 9s|8.8|good cost benefit
1817|alemargor.08|xiaomi redmi note 9s|5.5|whenever the phone fell the screen had to be repaired due to internal breaks
1818|ThewarDuckling|xiaomi redmi note 9s|8.9|good team
1819|SoulCrack|xiaomi redmi note 9s|9.3|excellent equipment brutal performance excellent battery very nice design unbeatable price quality
1820|josephmsola1|xiaomi redmi note 9s|9.5|very happy with this terminal
1821|gdeevaa|xiaomi redmi note 9s|10.0|amazing
1822|yoner_ber|xiaomi redmi note 9s|7.7|a good machine the year it came out was one of the best in its range
1823|khafiz6670|xiaomi redmi note 9s|10.0|worth the mid spec spec that tastes good at marhein friendly prices
1824|ogaca1976|xiaomi redmi note 9s|6.1|for 160 highly recommended
1825|lucadelbene222|xiaomi redmi note 9s|4.7|owned for about 2 years cannot wait to get rid of it continuous software bugs and factory defects like pros sensor
1826|JMAS|xiaomi redmi note 9s|8.3|very complete
1827|left_dead_2|xiaomi redmi note 9s|9.6|good pretty and cheap
1828|joaquinllambi11|xiaomi redmi note 9s|9.0|complete in every way
1829|CrisMG2509|xiaomi redmi note 9s|10.0|excellent team
1830|agelos1994|xiaomi redmi note 9s|10.0|very good mobile phone
1831|sistemashecc|xiaomi redmi note 9s|10.0|power and fluidity
1832|warley.ferraz.wf|xiaomi redmi note 9s|10.0|great phone left nothing to be desired
1833|pampullo11|xiaomi redmi note 9s|9.4|finally the my max without frames
1834|nico_v99|xiaomi redmi note 9s|9.4|an excellent cell phone at an incredible price
1835|angelanamanzalvos11|xiaomi redmi note 9s|9.3|very good mobile it only lacks the nfc excessive size and weight
1836|maximiliano12092007|xiaomi redmi note 9s|8.8|very cheap very powerful
1837|danielcapisalazar|xiaomi redmi note 9s|10.0|very good experience when executing demanding games and its camera in the day is very good
1838|leonardoarevalo99|xiaomi redmi note 9s|9.1|an almost perfect phone
1839|MartinGentile1|xiaomi redmi note 9s|9.4|money well spent
1840|victor1251999torres|xiaomi redmi note 9s|10.0|very good mobile
1841|dave0922|xiaomi redmi note 9s|10.0|excellent mobile
1842|rw.syndicate|xiaomi redmi note 9s|8.1|i am happy to play with this model and that is what i wanted
1843|alexdavid777|xiaomi redmi note 9s|9.0|excellent phone
1844|larissasilva.silva190|xiaomi redmi note 9s|9.0|the best cell phone i ever had
1845|jonaguirrev|xiaomi redmi note 9s|8.6|i do not recommend it
1846|alxndr0998|xiaomi redmi note 9s|8.7|i love cell phones and i think i made a good choice when i bought it
1847|pedrogaspar2004|xiaomi redmi note 9s|10.0|undoubtedly one of the best quality / price phones great 
1848|jose.domingo|xiaomi redmi note 9s|3.0|sooooo slow little optimized
1849|m4riof3rn4nd|xiaomi redmi note 9s|10.0|it is an amazing phone i bought it on december 20 2020 it runs all games very well
1850|josearroyog19|xiaomi redmi note 9s|8.9|good nice and cheap i recommend it
1851|jartyperez|xiaomi redmi note 9s|7.2|improvable screen fingerprint reader very fast
1852|fabestsan17|xiaomi redmi note 9s|9.3|i am satisfied with the device
1853|randy-castillo-martell-6162f9ed9dbc6|xiaomi redmi note 9s|8.6|pretty good
1854|deivysantiagoriverocamacho|xiaomi redmi note 9s|8.0|very good but bad camera
1855|Aereous|xiaomi redmi note 9s|8.2|guaranteed fluidity to date
1856|lucascelis988|xiaomi redmi note 9s|10.0|excellent
1857|brian_os|xiaomi redmi note 9s|9.6|very good
1858|kukula303|xiaomi redmi note 9s|8.6|very good
1859|juanbadilla107|xiaomi redmi note 9s|7.7|it is good but it has things to improve
1860|Dan42|xiaomi redmi note 9s|10.0|great good value for money
1861|herobrine08498|xiaomi redmi note 9s|9.4|improvable satisfaction quality present price
1862|jeremysantana626|xiaomi redmi note 9s|6.5|good but without miui
1863|Lalo_Parra|xiaomi redmi note 9s|9.8|it is the best device in quality price
1864|ahmadpour6871|xiaomi redmi note 9s|7.7|very good and heavy lee
1865|milhano|xiaomi redmi note 9s|8.0|very good quality/price ratio
1866|joan.tomas.miralles|xiaomi redmi note 9s|8.5|good phone quality / price
1867|jv-silva-5f03749846616|xiaomi redmi note 9s|10.0|amazing
1868|ruben.ladeira|xiaomi redmi note 9s|9.4|excellent value for money
1869|Angel.Priego|xiaomi redmi note 9s|8.4|the phone is a big thing compared to another i have had
1870|adrianhierro|xiaomi redmi note 9s|6.2|brutal autonomy sufficient benefits
1871|aljomaro3|xiaomi redmi note 9s|10.0|excellent
1872|michalis8980|xiaomi redmi note 9s|9.1|flawless mobile 
1873|milagros576|xiaomi redmi note 9s|7.7|a wide screen and good battery
1874|alejandroale|xiaomi redmi note 9s|9.0|best buy
1875|cardebas1129|xiaomi redmi note 9s|8.1|it is good in its version of 128/6 if you want this device if or if you have to buy this version
1876|krupao980|xiaomi redmi note 9s|9.3|the best phone up to $ 228
1877|lolicono2000|xiaomi redmi note 9s|10.0|it is an excellent team
1878|anonymous_165173_5e9ba2468759c|xiaomi redmi note 9s|4.9|the screen is disgusting with each generation they get worse
1879|raxtum|xiaomi redmi note 9s|3.7|nice budget phone
1880|carlos.pulgarin01|xiaomi redmi note 9s|10.0|the ideal quality price cell phone
1881|TanGar|xiaomi redmi note 9s|8.7|good phone for 13k
1882|davidmantilla1503|xiaomi redmi note 9s|9.1|it is good for the price and with a good processor
1883|deyvidluz|xiaomi redmi note 9s|8.9|excellent device
1884|jacvelher420|xiaomi redmi note 9s|7.2|good cell phone but it has a lot of bugs
1885|yosoykiramonram7274|xiaomi redmi note 9s|10.0|in my experience
1886|dany54|xiaomi redmi note 9s|10.0|the best smartphone in quality price
1887|rafaelvas20|xiaomi redmi note 9s|8.7|it is a good mobile
1888|franchase1994|xiaomi redmi note 9s|7.6|i am not very convinced
1889|brayanncraft|xiaomi redmi note 9s|7.8|good but nothing to write home about
1890|crsiano|xiaomi redmi note 9s|1.3|i would not buy it again and even less in a xiaomi store
1891|jfe93|xiaomi redmi note 9s|8.4|good device for the price it had in its day
1892|jafarvandmansour|xiaomi redmi note 9s|8.3|good phone in every way
1893|dg17.com|xiaomi redmi note 9s|8.4|good for your money
1894|rexofter|xiaomi redmi note 9s|10.0|i bought it recently and it works very well for me in daily use
1895|2teusfree2|xiaomi redmi note 9s|10.0|very good in everyday life and in games
1896|angelmfuentes91|xiaomi redmi note 9s|9.1|good mid range team
1897|vicentecartagena33|xiaomi redmi note 9s|10.0|an excellent mobile for day to day the vibrator and the haptic response is very good
1898|losbraylim12|xiaomi redmi note 9s|7.5|the bad thing is the software
1899|degodoisilva4|xiaomi redmi note 9s|10.0|best middleman i have ever had
1900|Luiscontilde|xiaomi redmi note 9s|9.2|i am happy very good image and photos i do not love miui
1901|9628370142z|xiaomi redmi note 9s|10.0|the phone justifies its money
1902|wightcharlie771|xiaomi redmi note 9s|6.3|disappointed
1903|ggragone|xiaomi redmi note 9s|9.7|i really like the screen and the design with the gcam beautiful professional photos come out it has some bugs sticking with miui
1904|jefry-acosta-5fa29e3a036ee|xiaomi redmi note 9s|7.7|it is good
1905|oswaldo7777201278|xiaomi redmi note 9s|8.5|great mobile for its price
1906|rmrojasp17|xiaomi redmi note 9s|9.3|well without reaching excellence
1907|arturhenriquebc|xiaomi redmi note 9s|10.0|great
1908|alexanderfrancasoares2002|xiaomi redmi note 9s|8.0|an excellent value for money when i bought it i had an excellent experience
1909|haroldjosuept123|xiaomi redmi note 9s|5.0|price quality 
1910|Asterix|xiaomi redmi note 9s|8.8|an almost perfect mobile
1911|alesolomadi|xiaomi redmi note 9s|9.4|very good quality / price ratio
1912|sebazent14|xiaomi redmi note 9s|10.0|very good cell phone
1913|Duglas|xiaomi redmi note 9s|8.0|good phone for daily use some jerks
1914|fredbatista2105|xiaomi redmi note 9s|7.9|it is a good phone
1915|valentinedgardopedroza|xiaomi redmi note 9s|9.5|excellent price quality
1916|AndreStork|xiaomi redmi note 9s|8.8|absolutely good phone for the price
1917|mumtaz-mahal-61e65581f227f|xiaomi redmi note 9s|9.6|excellent performance
1918|unprop56|xiaomi redmi note 9s|8.8|it is a good mobile for games daily use
1919|leno-silva-sousa-oliveira-6181effc28f6b|xiaomi redmi note 9s|10.0|great cell phone i liked it a lot
1920|leoaviles2003|xiaomi redmi note 9s|9.9|it is a phone that does not disappoint in the least
1921|xemilio0zx|xiaomi redmi note 9s|9.5|good battery and power for the price
1922|Mads|xiaomi redmi note 9s|9.5|good mobile for little price
1923|juniormrv98|xiaomi redmi note 9s|8.4|very good
1924|david2002rios|xiaomi redmi note 9s|8.2|an economical mobile with good balanced characteristics
1925|alvarobarretoce|xiaomi redmi note 9s|10.0|a good mobile highly recommended from the redmi range the best for its price
1926|adriano-rubens-macedo-63b713fd3d338|xiaomi redmi note 9s|6.0|very good at first then frustrating
1927|samuflex|xiaomi redmi note 9s|9.1|excellent phone
1928|arturoreyes159|xiaomi redmi note 9s|7.6|if you had an old phone it is so worth it
1929|alixinayala|xiaomi redmi note 9s|8.7|balanced
1930|rodry.alva2004|xiaomi redmi note 9s|9.2|it is what i expected
1931|jonnys2809|xiaomi redmi note 9s|8.1|great
1932|gibran.sega|xiaomi redmi note 9s|9.3|good pretty and cheap
1933|etienne222003|xiaomi redmi note 9s|10.0|beautiful powerful and cheap
1934|gibeegoldo|xiaomi redmi note 9s|8.5|diary and battle terminal
1935|elpapoelg|xiaomi redmi note 9s|9.1|my experience
1936|sebasl97|xiaomi redmi note 9s|9.6|excellent mobile good value for money
1937|salah-eddine-derouiche-62770d0789a7a|xiaomi redmi note 9s|10.0|very good phone for the price
1938|gesteban17k|xiaomi redmi note 9s|9.5|excellent cell phone and great performance
1939|Speed|xiaomi redmi note 9s|10.0|very good cell phone
1940|ds0626cd|xiaomi redmi note 9s|10.0|amazing
1941|luis-camargo-624dc59035454|xiaomi redmi note 9s|6.5|it is a good phone but its software ruined it
1942|sjacjcn|xiaomi redmi note 9s|10.0|one of the best premium intermediaries
1943|dargon200424|xiaomi redmi note 9s|9.4|good cell phone for a young person who does not need much
1944|iony.nav23|xiaomi redmi note 9s|8.8|good equipment at a good price
1945|carolvertelo|xiaomi redmi note 9s|10.0|excellent device
1946|patotskianton|oneplus 9 pro|9.4|very good my best phone in compare with all previous
1947|angel00xranitel|oneplus 9 pro|9.5|the best value for money flagship smartphone of 2021
1948|john_prigos|oneplus 9 pro|10.0|the beast
1949|Lancelot|oneplus 9 pro|9.9|very nice and very good phone
1950|omaradnan0155|oneplus 9 pro|10.0|amazing phone great screen and camera is pretty good when you try it yourself
1951|JaviduJ|oneplus 9 pro|6.2|bad battery bad software
1952|guevaraesp16|oneplus 9 pro|9.3|excellent performance at a contained price
1953|richard.pranzo|oneplus 9 pro|8.9|top of the line
1954|willhespoir|oneplus 9 pro|8.5|overall it is a good smartphone however the battery is not amazing and some annoying bugs
1955|aalcarazp|oneplus 9 pro|8.8|powerful nice but little battery
1956|christiandavidap0|oneplus 9 pro|10.0|amazing
1957|spampapelera85|oneplus 9 pro|10.0|recommended for demanding people
1958|joserdzrmz777|oneplus 9 pro|9.9|a high range worthy
1959|jeromflo|oneplus 9 pro|9.7|good mobile but camera can be improved
1960|hamner144|oneplus 9 pro|9.1|a powerful cell phone
1961|elsebas007|oneplus 9 pro|9.9|premium high end mobile fluid and with a justifiable price
1962|amoralessanchez|oneplus 9 pro|10.0|powerful ergonomic beautiful
1963|danielfernandezgarvin|oneplus 9 pro|10.0|pure performance 100 x 100
1964|darkpraix|oneplus 9 pro|5.9|is even better
1965|oriolribaguinovart|oneplus 9 pro|9.9|good mobile
1966|kocik1945|oneplus 9 pro|10.0|great phone already the third in the op series
1967|elionaialine|oneplus 9 pro|10.0|it is worth every penny invested 
1968|javier.laideal|oneplus 9 pro|10.0|oneplus excellence comes at a price
1969|bertoride|oneplus 9 pro|9.5|a mobile that is worth all its price
1970|maxiara2120|oneplus 9 pro|9.8|improvable battery but highly recommended equipment
1971|franmaldonado1979|oneplus 9 pro|4.0|nice fluid expensive and poor battery life
1972|blackmoonstah1|oneplus 9 pro|10.0|a flagship for little money
1973|kagm2312|oneplus 9 pro|2.4|a bittersweet taste
1974|20drug13|oneplus 9 pro|10.0|convenient solid phone
1975|alexyecla|oneplus 9 pro|8.2|excellent but with some drawbacks
1976|vincentlow1989|oneplus 9 pro|5.0|the device is normal but the software is crap
1977|daniel.h.mobil|oneplus 9 pro|9.6|chic phone and very good performance
1978|edyvanio1997|oneplus 9 pro|9.0|very good it suits me in everything
1979|migue_appmovilshop|oneplus 9 pro|9.6|premium phone in almost all aspects
1980|fmoraenriquez|oneplus 9 pro|7.5|good for its price
1981|andrefsantunes|oneplus 9 pro|8.7|brand that never wavers
1982|flaviotoia|oneplus 9 pro|9.7|excellent update
1983|cyrill-blaszczykowski-6286b74d49cbd|oneplus 9 pro|5.0|minimum updates
1984|cesar-araujo-63a33213e6105|oneplus 9 pro|9.4|great mobile for daily office use games and photos
1985|jimeiro1976|oneplus 9 pro|9.5|aesthetically splendid
1986|lucio20143194|oneplus 9 pro|9.2|excellent team
1987|erdemyalcin968|xiaomi redmi note 9|7.8|good
1988|georgehep|xiaomi redmi note 9|7.0|great phone but terrible service back up when it crashed
1989|malanjayaranga|xiaomi redmi note 9|7.0|good phone
1990|moh23|xiaomi redmi note 9|7.0|good phone
1991|redha.mec06|xiaomi redmi note 9|10.0|good phone for everyday use
1992|facundo-adorante-616b7620a5850|xiaomi redmi note 9|7.7|nothing especial
1993|abodkamal5555|xiaomi redmi note 9|10.0|perfect for everyday use entertainment design and display quality
1994|mohamed-laknizi-5a6e436f8a7e9|xiaomi redmi note 9|1.0|i hate this phone
1995|i_am_albertico|xiaomi redmi note 9|6.5|i spent a day with this cell phone and i sold it later
1996|anonymous_119247_5f9c582704feb|xiaomi redmi note 9|4.6|bad buy
1997|danymibc|xiaomi redmi note 9|7.8|if you are looking for a cheap and balanced cell phone this is your option
1998|mathew-lopez|xiaomi redmi note 9|8.3|it is a good phone if you do not want to spend more than $ 200
1999|wightcharlie771|xiaomi redmi note 9|7.9|good option
2000|Valentin|xiaomi redmi note 9|4.4|i do not recommend
2001|chicotmat|xiaomi redmi note 9|8.5|very good battery good camera and improved performance
2002|am.deleglise59|xiaomi redmi note 9|9.3|very good smartphone compared to its price paid 158 
2003|jmartinezg2906|xiaomi redmi note 9|2.7|bad
2004|johnatan-solis-hernandez-5f769035bcd6f|xiaomi redmi note 9|8.9|good experience
2005|Ri4n3XX|xiaomi redmi note 9|5.0|disappointed
2006|qalejandror|xiaomi redmi note 9|5.0|a mediocre processor
2007|evroult|xiaomi redmi note 9|8.6|well despite a few points to review
2008|omarortega007voom|xiaomi redmi note 9|9.3|it is a great cell phone in terms of quality and price it is used for everything
2009|brhayan20|xiaomi redmi note 9|10.0|it is a perfect mobile if you do not have a lot of budget
2010|andresali917|xiaomi redmi note 9|8.1|quality price not bad
2011|brunotavaresdias|xiaomi redmi note 9|7.0|good phone but 
2012|habdielpm1|xiaomi redmi note 9|9.1|excellent
2013|xxmanolo2005xx|xiaomi redmi note 9|2.2|it is fine but what a time to shoot rockets
2014|djoba86|xiaomi redmi note 9|10.0|great i am happy 
2015|martigmips|xiaomi redmi note 9|8.6|not very slow with regular use
2016|isma17vs|xiaomi redmi note 9|6.9|good mobile for one or two years
2017|renzoocupaaliaga|xiaomi redmi note 9|7.6|excellent mobile in daily use
2018|gunsnkiller|xiaomi redmi note 9|4.1|slow in daily use
2019|emmanuel-araujo-5e27d7c44b10a|xiaomi redmi note 9|6.3|good but buggy
2020|frank-ponce-6086efebcad36|xiaomi redmi note 9|8.8|it is a good mobile to play as well as to see messages and videos the power is very good
2021|magosinlimites_23|xiaomi redmi note 9|10.0|very good purchase it is the most balanced in this segment of pressure
2022|abel.caguana|xiaomi redmi note 9|8.4|good but can be improved by updates
2023|tmurazik732|xiaomi redmi note 9|4.0|it constantly freezes
2024|Willi|xiaomi redmi note 9|10.0|good mobile at a reasonable price
2025|chris-ramsey-5f1af1efa2ecb|xiaomi redmi note 9|7.1|good but lage
2026|peterlikelokyuk6|xiaomi redmi note 9|6.4|good phone at an affordable price but in performance leaves to be desired
2027|jano.saumann|xiaomi redmi note 9|9.5|perfect in mid range and work
2028|alicelermanw|xiaomi redmi note 9|10.0|good cell phone for the price it has
2029|erodark5|xiaomi redmi note 9|8.2|it seems to me a good mobile despite having been with it for almost a year
2030|luisenrique38guinea|xiaomi redmi note 9|7.0|it meets my expectations
2031|matuarc|xiaomi redmi note 9|8.9|good cell phone
2032|manuelonja|xiaomi redmi note 9|10.0|i exceed my expectations
2033|Malcolm_SinQui|xiaomi redmi note 9|6.2|ok but there are better options for a little more price
2034|mamm.antonio.marquez.macias|xiaomi redmi note 9|9.8|in daily use it has been very good for me i had always used samsung i bought this just to test the brand and i was not disappointed
2035|angelrenealpha|xiaomi redmi note 9|7.6|good but there are better options
2036|agusadorante|xiaomi redmi note 9|7.6|poor performance
2037|kevinakp45|xiaomi redmi note 9|7.9|very good value for money
2038|asbelvazquezrodriguez|xiaomi redmi note 9|10.0|excellent mobile for basic use
